score,content_contractions
1,"i have already uploaded the medicine recipe, why i still have to consult before buying medicine?"
1,1. Cannot remove profile 2. Cannot delete account
3,"Doctor consultation always slow in responding, so 30 mins are running out quickly. Somewhat pricey delivery and service fee. Has insurance integration."
5,excellent. I feel sick on the way to my destination place. then i use halodoc. I got the medicine sent to my destinatiom place. Halodoc is awesome!!
5,Very easy to use
2,"What is wrong with the new updated app? I cannot order my medicine because it kept asking me to upload the prescription which is I did directly after I consulted with a doctor. Then, when I picked the payment, the page just brought me to do another consultation with a doctor since the app cannot read that my prescription is already uploaded. Turns out, the doctor who can give me another updated prescription are all not available. It is leading me to unable order my medicine. Great! Please fix this!"
5,Very easy to use
5,This app helps me a lot and it is user friendly. Thank you
5,Usefull and Better than the other apps
5,Very helpful and quick respon ... also easy to use even to buy the medicine its all there .. you just wait and in within 45mnt its already in your hand ... good
5,very simple and helpful
5,Fast and good response
5,Quick Response to solve the problem. Hopefully the medicine given by the doctor can makes better.
3,"My order has been confirmed but no driver to deliver the medication. I am waiting way longer than the estimated time. Unfortunately, no real live support team to talk with and there is only virtual assistant bot which has limited predefined questions. It is a bad user experience."
2,"Unreliable for not 'happy flow', slow customer service turnaround."
5,Excellent application & service
5,Very helpful app👍
5,Very good apps
5,Really helpful and easy to use
5,Very helpful & easy to use
5,The best virtual doctor apps
3,Cannot chat the doctor due to an error when I need it the most
5,This App was pretty good and user friendly.
5,Welldone halo doc. 💪
5,Good helpful user friendly
5,To do point Kerenq
5,You must not copy distribute disclose or distribute the message to the email address is tasya and make the use of this message was automatically and thanks for all your help with the email address and
5,Easy to use
5,so help ful
5,Good experience so far.
5,"Very useful application, it also give fast respon for your complain"
5,Nice app and good service
2,"Helpful but need a lot improvement. Instead of sending chat using sms, make a chat module."
5,Very helpfull for me and my family
5,Easy to use
5,This app really helpful and easy to use. Its necessary to help patient during pandemy. Thank you souch.
5,"An excellent app. I usually use it to buy medicine, and nothing more. I have not tried using other features. So far so good. Very practical and user friendly. It deserves 5 stars for now."
5,Very friendly doctor
1,Please fix the bug. Worst app ever. Tried to delete one of the order and tells me that need to start all over again.
5,"Very satisfied, keep up the advancement system🙏"
5,Useful while lockdown
5,easy to use
5,So fast and effective
5,Like it much
5,Choose the righ doctor..
5,must have app for health assistance
5,Good apps..good service
5,Happy to know halodoc
4,I cannot download the digital receipt.
5,"Good job, good aplication"
4,"Halodoc should provide more information why a delivery is canceled, and make the best attempt to automatically reorder it (Do not just cancel and refund). Or, provide a simpler way to reorder it manually than going through the store menu."
5,"Respond within expected time, very usefull apps people no need to go out to see doctor and get medicine. It is easy and save time."
5,Maka my life easy...
5,Simple and fast. Well done
5,Great app for consult with doctor
5,Very helpful apps.
1,If only we have another option :/
5,Thank you to make life easier
5,Good application to consulting with the doctor. Recommended .. 👍
5,"Smooth UX, UI, fast, helpful doctor. Thank halodoc. Sukses terus"
5,"Really helpful, especially in this pandemic period, online consultation, online medicine recommendations, it makes us easier to find the 2nd opinion and quick solution when we got sick."
5,Good and easy to use
5,Nice and easy to consult with doctor
5,Easy to use!
5,Good consulting & medications carefully
5,actually save lives
2,i do not understand why Halodoc always recommend me the farthest drugs store from my house and it makes the delivery fee is more expensive
5,Thanks Halodoc. Thank you for your apps
5,Very usefull application
5,Really helpful for urgent situation. Fast respone.
5,Friendly user application
5,Responsive chat support.
5,Fast response and user friendly
5,Easy to use
5,"Just realized there is some kind of bug in the app. When i tried to open my appointment history, there are only a sign 'try again' but it did not solve anything. But for overall app, i really love Halodoc because it helps me a lot for laboratory appointment or even have a chat with the doctors. This apps also make a vaccine appointment a lot more easier."
5,Fast respon and friendly
5,Instan help and consultancy
1,Always freezing or forced close whenever I tried to open my history transactions.
5,So easy to use and simple so we can consult with doctor immediately
5,It would be nicer if there is a sick letter for us as a evidence that we are not feeling well. Thanks
5,Makes life easier
5,Fast and easy
5,Really usefull in emergency
5,"As a mom with many children who has to stay at home, this app is helpful masyaallah"
5,Super helpful. Love it!
4,Good aplication and reliable so far
5,"Very useful, we can consult to a doctor with our preferences, without leaving home, especially in this pandemi era"
5,Very user friendly and suoer fast service!
5,Excellent and helpfull.... Thanks Halodoc
1,"I bought medicine from Halodoc that need prescription. The medicine came has already expired, and I cannot buy another one because the prescription can only be used once. The helpdesk said they would be reach me in 24 hours, but they have not reached me until now. If my illness is chronic, I would have died from either my illness or the expired medicine. Slow customer support 😶"
5,Great app 👍🏻
5,A helping hand just a click away
4,"as an apps, this is a good apps that is easy to use with complete facilities for health purpose. my only 'complaint' is the menu to get to customer service when something went wrong is not intuitive and not easy to use. you are most of the time redirected to FAQ"
5,Fast response! Great!
5,"easy to use, profesional medical assistance"
5,THE BEST HELP
5,Useful and user friendly UI
5,Very responsive ans helpful
5,Keep a good work and uphrade for more best experience
5,"Helpful, especially for covid patient"
4,Helping many things of getting better solution by Doctor immediate action
5,Awesome application and user friendly. Keep it up.
5,"My first contac with halodoc, surprise I can😆"
5,Easy to use and verry helpfull
5,Easy to use
5,"Cannot refund, my transaction got cancelled and when i input refund form it is always failed. edited : They reached out to me and sending my money back.👍🏻"
5,Very very helpful
5,Easy to use and clear
5,very helpful apps. thanks 👍👍👍👍👍
5,Great Service for Online Health Service
5,So impressive. I have dry cough and within less than 30 minutes I got the cough syrup that I need. The app payment system is also so smooth and not complicated. The process is so easy and not convoluted like any other similar app. Well done. 👍👍
5,Very good apps. Nice and helpful doctors.
2,Hallo Doc makes me need Hallo Help desk. Any CC and VA were failed.
1,"This app is getting worse I cannot buy anything in this app now because it keep declining my payment, please fix it"
5,Thanks for everything ❤️
5,Terbaik...👍👍 great app..user friendly..😍👏👏
3,"Its getting worse, driver ask me to cancel the order due to delivery point seems to far from him (from surabaya to gresik). The chat assistance not helping, there is no option for cancellation, I should call the CS to cancellation."
5,"Very practical and helpful, especially during pandemic 👍"
5,"Good, helpful apps, easy to use."
2,Errors most of the time... How can this app be used and got 4.8 rating???
1,"After updating the app on 2 August 2022, now it does not work at all. Very disappointing. please check again soon."
5,Simp Dan efficient
5,Friendly doctor. Explain everything
5,User friendly 👍
5,Fast respond and delivery
5,"Good service, details, fast and doctor are friendly."
5,Very helpfull when we need medicine immediately
5,So help full ... thanks
5,Very helpfull although UI need some enhancement to inline with customer experience
5,Very very Helpful
5,Quick and easy to order medicine online.
5,Convenience and reliable
5,Good application...the application is very useful for helping my family who are sick
1,"2 times cancelled and the money never refunded, worst medical app, better use another app"
5,Really helpfull.. Thank you Halodoc.👍
5,really great and useful
4,Quite easy to reach the docter.. but the reply answer a little bit slow
5,"So far, the app is useful and helpful."
1,i bought some medicine but not delivered to me.
5,"Good apps, very helpfull"
5,Easy to use and friendly user interface.. the doctors work patiently and gave a clear explanation and it help thank you
5,Fast response and service excellent
5,Working very well
5,Very good n fast
5,Easy to use and interactive
5,Good response & solution
5,Easy to use
3,Location of GPS feature is not accurated. Please fix this GPS Feature in this app.
5,Previosly I used this app only to buy some medicines & vitamins. It is getting better now with the online doctor consultation & prescription. Very convenient.
5,Great app with efficient service and care from the doctors
5,Helpful apps. Thank you
5,Best apps! Thank you doc..
5,Easy find information
5,"Like the interface, the fast response of doctors and ease of use"
5,"Helpfull, easy to use"
5,Good apps for health care
5,Good app.. helpful
3,"Bug , bug , bug ..."
1,I do not get it
5,Helpfull in distress
5,"Helpful, keep your great services 👍"
5,So much help during this pendemic situation. Thank you for all Doctos in charge
5,"Thank you halodoc, you make my life so easy to get healthy without go to hospital, so helpfull to have this app"
5,Very helpful apps in covid
4,Very bad UX for gojek user. Only add hassles. Why does not gojek just integrate this service into 1 gojek app. Just like go food or other services. You force me to install this app.
5,Doctors are very nice and helpful ..
5,"Easy to use, fast connect with the Doct"
4,Please still can change the name even though it is been verified
5,Really helpfull when i need medicine in the middle of the night
5,Very informative ideas Thanks dr Ayang
5,"Practice, simple and helpfull"
5,Fast process for urgent needed
5,Really halpful at any time.
5,Always have good experience
5,Very good experience..
5,From looking PCR test to doctor consultation.
1,"The app just getting worse. I was not able to consult with the doctor because ""Error Loading Messages"" kept showing until the consultation time has passed, while I had paid the fee. The CS was not helpful either. I tried to contact through apps but it did not work properly and after I sent the proof of error in the chat, the helpdesk did not showing anything. I called the CS, they said I need to send the proof through email (so I did) and the team will investigate before givin any update to me"
2,bad apps. location not accurately
5,Simplifying everything in healthcare!
5,It was very helpful and very convenient for me
5,"fast response, answer the detail as we need.... good communications"
5,Help me a lot when i need my medicines and i could not go out my house!
4,Could not save profile changes :/
5,"Nice, help much"
5,Comfortable user interface and fast response doctors.
5,"Easy to use, straight forward, simple. Top."
5,easy to contact
1,"Chat sucks cannot even use it. My medicine not arrived yet, even with status ""driver ditugaskan"""
5,That is very helpful apps.love it
5,"Easy to use, good and caring doctor"
5,"Very helpful application, awesome. Very good luck Halodoc!"
5,Very helpful thankss
5,The doctor very helpful and swift respond.
5,Helpfull and easy to use
5,User friendly... ! 👍
5,my first experience using Halodoc and it was amazing.. 5-star service. Trully recommend!
1,So dificult to sign in. Bad apps.. 😡
5,Easy n helpful...thanks alot
5,"Lots of features, helpful doctors, only a click away. What a great way to make medicine more accessible."
5,awesome it help me a lot
4,"Please update the bug (i think the problem only happened on Android). The app just will not allow us to make an appointment ""jadwalkan""."
5,Very helpfull apps esp in emergency situation
2,The map is not accurate and I think the notes is not delivered to the driver. I often have to reconfirm my location to them and it is such a hassle.
5,Thank you halodoc
5,"Best solution in your emergency. But maybe the price should be lower, even there is a range between low and high, the app always pick the highest."
5,Very helpful applications. It is easy and practical
5,"Very helpfull,especially for those who forget to bring routine medicine when travelling.. Just need less then 30 minutes from search to get delivered medicine..awsome..!"
4,Very good and efficient delivery
5,Very good app
5,Best apps when you in need of dire consultation
5,Keep up the good work
5,Good service Will use it again
5,Good apps very helpful
5,Halodoc always saves the day 👍🏻
5,One stop health solutions
5,Easy to use
5,Good easy to use
5,I like this application since there is option to choose instant delivery in 45 minutes
1,"Wrong order sent. told consumers to wait up to 7x24 hours, but to no avail. the problem is in the application and catalog view. bastard! return my money !"
1,Unsolved bugs since weeks ago. Cannot search medical services.
5,Very helpful and user friendly apps
5,great ui ux
5,"Fastest response, easy to use two thumbs up"
2,"Cannot even login. Got the code and working internet connection but it always says no internet connection. Tried again, it changes to expired code although the timer has not expired yet."
5,the UIUX is the best👑 Halodoc helps me a lot looking for online psychologists/psychiatrists
5,"Helpfull, nice doctor, easy to get medicine"
5,Very nice experience
5,The doctors are very helpful. Thanks halodoc. I can consul with doctor anytime.
5,Very usefull app! 👍
5,Easy to use
5,Good app to find medicine within city !
5,This app really helps. You are able to consult with a real doctor trough this app!
5,The best healthcare app so far. I had my first consultation at 12 and order my medicines at 12.15 and got them at 12.50. Thank you Halodoc.
5,"the chat feature can give me the preliminary exam on my wound. if it goes bad, then I can decide to go to hospital to see the doctor"
5,Very good aplication
5,Good and useful apps
5,"Dokter good response, helpfull"
5,Really help us moreover during pandemic 💖 Thank you
4,Sometimes rather slow
1,Unreliable partner and their customer service does not have capability to solve the problem
5,It is really good and convenient
4,First Impression is great
4,Would give 5 star but app keep loading VA
5,Easy and helpful
5,Very Helpful Apps. Thank You.
3,Should have a menu where we can download doctor diagnosis for reimbursement process Edit: Adding +1 star because CS customer centric attitude
1,I have been trying to order the usual meds for my mom and dad for days and it keeps giving me error messages. chat box is useless as I could not get any answer for hours as well. please fix your app
5,Swift service and delivery
5,Delivered in 30 minutes. Good job. Thank you
5,Easy and very useful
5,Good app.. very helpfull
5,Usefull and bendy
5,Very helpfull apps to get Doctor advise when in emergency condition.
5,This app really helped me. I Am so thankful in this occasion...
5,Very easy to use.. great app
5,How to give tips or credit to courier / driver ?
5,"From consulting via chat with doctor to medicine delivery, everything went very smooth.. delivery only took about 30 minutes. Good job halodoc for providing good service"
1,"Worst service ever. I bought medicines on April 28th 2022, AND IT NEVER DELIVERED till now (May 19th 2022). I contacted the CS, the shipping service, anything. Well, at the end, it refunded. I still have money here, and I do not know what to do. I do not want to use this app anymore. Trash 👎"
5,Very helpful and fast response. Doctor's analysis based on chat and picture but the diagnosis almost right.
5,Very helpfull when you need some medicine in immediate time.
5,Fast respond and very helpfull in this pandemic situation.
5,Very helpful apps. everyone should use this app
5,"What an useful app, especially when we are in need of health advices and medicines."
1,"I feel disappointed because I got the medicine with high price but the worst things it was nearly expired date, there is no option to refund those medicine, I spent over 100k for Nearly Expired things, so awful !"
1,"Is it only me or Halodoc is having too much error with delivery? I experienced 2 issues within 1 week, 1st one was the store canceled my order with no notif and no action taken afterward, then I need to chat and call CS to get my transaction repurchased. 2nd due to the driver was not moving at all after 1hr being assigned. Turned out the driver was waaaaay too far from the store, and of course I needed to call the CS and only God knew when my meds would arrive."
5,Nice and fast
5,Helpful and easy
2,"I cannot chat with my doctor, the app says error loading the messages"
5,great app...user friendly
5,Very useful even in a case of emergency... Awesome
5,easy and convinient
5,"Excellent easy for customer, specially with payment metode (bca virtual account)"
5,excellent app for healthness consultancy
5,Really quick and simple to use
1,"The WORST WORST APP. I ordered medicine for my mom, it should be delivered instant within 30-40mins But i have been waiting for 3 hours and the status was still ""confirmed"" I tried to cancel but somehow it said ""your order has been confirmed and will be proceed soon"" And keep saying that. I tried to use chat box BUT IT WAS SO USELESS, it just auto reply and did not helping at all! I called the CS and everytime they said ""currently there are no free agent which can help"" SUPER WASTE TIME N MONEY!"
5,I got the necessary help immediately
1,"It used to be ok but i just had consultant with dr umum, no med no help, done, no place to score or complain or return the money, i just delete my account and app, 1 star for wasting time and money"
5,easy way to consult and get the recipe
2,Cannot intall the apps just now.
5,great for the 1st order.
4,Good aps good doctor
5,easy to use and very functional
1,"ordering medic and i waiting for too long, and its over than estimated time, could you imagine the call center just answer with 'maaf ada masalah jaringan' excuse me? you kidding? you are a medical service, not a food service! Get it?"
5,"Proper, fast and good information 👍🙂🙏"
5,"I was on the holiday with only my toddler when I got my vertigo so no one can help me. I talked to the dr from halo doc and get my medicine immidiately. Very easy to use and helps me alot, easy to pay with the link to gopay. Thank you halodoc."
5,Very easy & helpful
5,user friendly and connection with doctor n apotik very fast
5,Very helping in every situation
1,"Order medicines, 2 hours waiting.. Cannot cancel, Chat to Customer service not get any respond. After 2 hours, tried to call the Customer Service, told me that there were error in Gojek's. OMG, 2 hours + wasted IDR 12k to call you, so 1 star for you! Bye!"
1,"installing this app just to uninstall it. I cannot link to my gopay. It said my number has not connected to any gopay account, yet I have received gopay otp to connect with the apps. I tried to reconnect it again several time and still going nowhere. uninstall then"
2,I have been using this app for long time then I need uninstalled it because there is no space in my phone. After that I tried to install using different phone. But it said I could not install halodoc
5,Very useful app
5,Very helpful & easy
5,"easy, usefull, updated"
5,"Fast respon, and dokter always standby"
5,"Reliable & convenient, keep it up halodoc!"
5,very fruitful and friendly
4,So far really helpful to chat with professional
5,"Amazing Application, very helpful"
5,Very helpful in every critical moment. Thanks.
5,"nice, media consultation about health"
5,"This app really really makes my life easier... You deserve 10 stars , brilliant"
1,Medicine brands are extremely limited
3,"So far it is been helpful. But the map is unreliable and the drivers seem to not reading the note. I could not find my orders until now. The info just shows whether it has been delivered or not, but no info who accepted it picture of the person who accepted it. So when they delivered the medicine to the wrong person, to track it was such a hassle. Maybe fix that part."
1,"Your app really need serious upgrading so much. I made appointment to doctor in hospital, turned out the doctor is switched to another doctor schedule without notifying me. Also the hospital took ages to confirm my appointment, they said because your system also slow as hell. End up I cancelled my appointment on this app and made manually appointment at the hospital for next week. Imagine I have to hold my pain till next week. Think again what is your purpose made this app."
5,Fast and responsive
1,"I have valid prescription from doctor and upload it to the app, but the app reject it, so I could not buy the medicine. I do not see any use of this feature. My previous review has been deleted."
5,"Great,, please put more discount or promo options"
1,"Cannot order medicine with prescription..i used allianz as payment, when i click order, the apps return to homescreen and my order stay in the basket. Buggy apps"
1,Its not loading
4,Easy to understand
4,"Mostly it work as expected, there is a time the payment not working."
5,This apps is superb. Easy to use and very helpful. Super recommended.
1,"App always crash, cannot order my medication. Everytime I click order button it always direct me to the homepage."
5,Usefull and helpfull apps
5,It is good to deliver the medicine but no with the consultation
5,Simply and easy to use
3,"The app is ok, easy enough to navigate, but the quality of the doctors has diminished recently. I used to get accurate diagnosis from doctors here even the ones who were still ""Free"" at the beginning. Now I can pay up to hundreds of IDR just to get rude doctors who just do not care, spend the 30 minutes only replying twice, or just do not know what is wrong with me. Please select your doctors well."
5,Good and usefull
5,Easy to use
5,Nice Apps. Really helpfull. Thank you
5,Helpfull and usefull
5,Good aplcation for helping me
5,Quick & very helpful
5,"Life savior, thank youu"
5,Very helpful & practical
5,Very usefull and easy to communicate with doctor without in line in the hospital. Many thanks Halodoc
5,"First time but good experiance, thanks"
5,Easy to use.
5,easy & fast
5,I admire halo doc for connecting professional without distance matter. Thanks
5,Fast & Helpful
5,"Doctoc was response quickly, Thanks dok"
4,1st use this app. So far so easy
1,System issue when ordering the medicine. It not solve until now (3days). Caused we cannot get the antivirus which is very important for my daughter.
5,Quick response.. Thanks dokter Yohanes
5,Thank you so much
5,Please inform how to buy Fapiviravir
5,Really helpful for me to find a medicine in urgent situation
5,The doctor was responsive and the medications were aligned with the national standard 👍
5,Fast and to the point
5,Very helpful telemedicine
4,So far still good
5,"Best apps... easy, responsive, effective"
5,Problem solved Thank you
5,Good service and fast
5,A very helpful app! Thanks for making it easy and simple 😁
5,"Very simple, efficient and fast response. Reliable apps"
5,"Very helpfull, easy communication, and easy to purchase the medicines."
4,Really helpfull when I cannot go outside to buying medicine
5,Clear n fast
5,This apps is so much helping
1,Cannot sign up bruh
5,This app is really helpfull for me and my whole family at home specially about medicines.. keep up the good work..
5,"Got a bit confused at first on how to move around the app, but it turned out pretty easy"
5,Professional and helpful response.
5,Thank you for helping us
5,"Good app, good responses"
5,Easy to use
5,Good for emeregency help
5,Very helpfull apps
1,"I have just deleted my account and uninstalled this app. You better delete all my details in your database, as you and I are the same: we do not want me to bring lawsuit into this, so you better delete all the data you have on me in your system. Yes, your app, products, and services have disappointed me that much. also, people, do NOT waste your time on this app. try the alternative (al******r). good riddance"
5,Love this app
2,Not easy user
5,"Helpfull, easy to use"
5,Work as intended
1,"I have a bad experience of receiving an expired medicine, and no good response for my complain, it is not a matter of money, it is a matter of trust. I have already uninstalled this app."
