score,content_contractions
1,"Tried to help a friend ordered medicine for his child who lives outside Jakarta, but it took long time to process the order (3 days) and delivered it. I placed the order last Saturday, and it has not arrived yet until today. What is going on? tried to place complain but the virtual chat does not help much! I think the app only works well in Jakarta or cities around Java, but it does not solve the problem for those who live outside Java. What a pity."
5,"very helpful , good experience chat with telemedicine doctor, fast response"
5,Easy to use and very helpfull
5,Really helpful app
1,"Disappointed experience in isoman package, less coordination in halodoc team n unpleasant service for pcr home feature.."
5,Very good and very useful
2,"I cannot download to pdf , the doctor recomendation and doctor notes. The pdf keep download unsuccesful"
5,Very helpful so far. Thanks for the good work!
5,Best of the best
5,Good app. So helpful
5,Very helpful app 👍
5,"Running so well, can consult clearly"
5,Fast and good response
5,Really helpfull. My question is why there is no drugstore' name?
5,Very helpfull in this condition. Thank you
5,Great apps and very effecient
5,helpful n quick response
5,thanks for being helpful in the right time
5,Good apps. so helpful
5,Easy way to consult with doctor and get medicine we need.
5,Helpful when you at home and need a doctor
5,Halodoc makes life so much easier. Thank you 🙏🏼
5,"Good apps, very helpful in current situation"
4,Better than before
5,This app has grown for the better in the years i had since first saw i launch! Fantastic! Recommended!!
5,Works well with my insurance
5,Very helpful for me.
5,simple and easy to use
5,Helpful Apps Thanks
5,Good advise and reasonable
5,Quick action in answer symptoms problem
5,Helpfull and super simple.. The Best..
1,"Got the worst experience of contact the agent via live chat. Extra note: halodoc does not have commitment to solve customer's problem although if it is their mistake. I need to chat CS several times and none of their answers ease me. By The Way i just need refund and after several chat i asked when they would refund my money, they finally gave me answer and it took almost 10 DAYS JUST TO REFUND Rp100.000. Unbelievable."
5,All good. Fast and cheap
5,Good so far
5,"A little bit buggy, can be better"
1,"Very bad app, I need to meet with the doctor immediately caused I got Omicron, but after checkout my payment are failed several times. I need doctor immediately bruhh ! You cannot play with patients with serious illness."
5,Nice.. easy to use
5,Great value & easy interface
5,"Very very useful, especially in this pandemic time"
5,"awesome app, easy to use"
5,It is always HelpFull apps specially with this CoVid condition and the Doctors are ready and friendly..thank Halodoc
5,So helpful apps.
5,Very Helpful apps especially during this pandemic so I do not have to go outside to buy any medicine
5,Great repond from the doctor
5,great and satisfied services
5,Good doctor .. good service .. thanks halodoc
5,Becoming 1st option to consult in this pandemic situation
5,"Easy to use, fast in processing and delivery"
5,"it helped me alot. fast responses, medicines, doctors are pretty fast responses. did not need to go outjust stay at home then the medicine arrived"
5,Fast and reliable
5,"Simple, easy, and helpful"
5,It is very useful especially during the pandemic.
5,Thank YOU Halo Doc.. Best Ways When Doctors are Closed on Sunday..
2,Your map directory seems not to work. I have been waiting for meds for more than 28 minutes as promised
1,Services is suck No respond after raising trouble
5,"Very helpful, thanks Halo doc"
4,"i never thought that i would be using this app. after using it, it helps a lot. thank you. keep up the good work."
5,when there is no any specialis doctor on holiday at the hospital. Halodoc gives the best solution for this. thumbs
4,Very helpful in every condition for Healthcare
5,"Really helpfull, easy to use (search med, payment n fast delivery) thanks"
3,Please make maximum distance to order medicine instant due too many times ordered medicine with different city condition too far away to be shipped.
1,"integrate your address information better to make me give more than 1 star, gojek driver was confused with the address and cannot find the extra info i write inthe address"
4,I need deleted account
5,Great app.. very useful..
4,"Easy app, easy experience though it has little adjustment to understand the menu."
5,Easy to use
5,24 hours profesional doctor consultation with satisfying service even from the young doctor.
1,Please activate to track my orders
5,help me a lot to fight with covid
5,Fast respon ..
5,Very useful application
5,Best medical service application
5,Good apps for direct consultation with doctors
5,"All you need when you are not well, they even send the medicine to your front door, instantly."
5,Very helpful 👍
5,Fast response thanks dok
5,Definitely better than going through the hassle of personally going to clinic and buying meds. Love it.
5,Very helpful and recommended👍
5,"Very useful and helpful. I am using it during pandemic situation, while we could not go out to seek a professional medical advisors, and buying medecine. Response is good. Price of consultaion and also response is good."
5,Easy and we will made app
1,Works for ordering medicine but not booking doctor appointments. Used credit card and got error message both times so went to ATM. Payment confirmed through ATM and appointment confirmed. A few hours later received message saying account cannot be confirmed and appointment canceled??? Over the yea9have made hundreds of payments through ATM and this if first time I had a problem. Nothing wrong with y credit card or Debit accounts as I was able to use both later that day with no problem online.
4,quite difficult to receive pin thru sms better with Whatsapp. There is no search to find the MD that handled us already just not to start from the beginning about my history of health
5,Can save time
5,Quick response by the doctor.
5,Very useful during a pandemic. Medicine delivery is also very good. Thanks.
1,Very bad experiences.. do not want to process refund
5,Service excellent 👍👍👍
5,"Easy to use. Very helpful, i have been use this app for swab drive thru, doc. Consultation"
5,24hours customer support chat is really good
5,Good app 👍👍
1,Content will not show
5,"Much better in handling and helping us , and utilizing our money, to get the right medical treatments. Better than ministry of health itself."
5,Easy to Use and awesome doctor
5,Really helpful thank you doctor and halodoc team always bring great information
5,Helpful enough for me
5,Helpful and thanks you so much
5,Very very heplfull application
4,It will be better if we can chat the driver during delivery and give them some tips
5,Best best best
4,So far good experience
4,Clean & Simple
5,"This is really good, and helpful, easy to use"
5,Good respon. Fast
4,"So far so good, but i am only try chat doctor only. Another module, did not know"
5,"Easy to use, nice doctors"
5,Simplifyng the complexity
5,Good so far
2,"I cannot scroll on the medicine lists, even though I have a very fast internet."
5,Its easy to use..
5,Easy to use.
5,So far so good. Consulting via halodoc and can be reimbursed in the office
5,very helpfull especially at times like this. good apps
5,So really helpful when pandemic situation. We do not need to get out from our home to buying medicine or check our health to doctor. Thankyou Halodoc and Gojek too! ❤❤
5,"Very helpful apps, and the doctors are kind"
5,Very helpfull and help many peoples
4,"5 star if test can check not only 1 city nearest coz I live in border area, so better nearest from pinpoint"
5,Very helpful indeed
5,"This app helping people to contact doctor, buying medicine and deliver it to your house"
4,So far so good sih
5,Anytime Anywhere That is what we need.. Dabest!
5,Its usefull for me as isoman. Fast response.
5,Very easy to use
5,great service and great help
5,Immediate and very good response. Easy to understand menu. Highly recomended
1,"Tried using covid doctor consultation service at halodoc as per kemenkes suggestion, searched preference doc, there is a sign that doctor was available for videocall. When I chat n ask to have vc doctor refuse. N i cannot cancel. Only can finish the chat and halodoc took that as DONE OF SERVICE so when i tried to use ISOMAN code again for another consultation it failed. How come? I did not even started the consultation yet as the doctor refuse vc"
5,"It is a good apps, user friendly, plenty of choices, quite cheap too than actually coming to the doctor..have a multiple place for infimary too..keep it up.."
1,CONNECTION PROBLE often shows connection problem even though i have good connection
5,Helpful and easy
5,"Very helpful, easy to use, responsive doctors off course 👍"
5,"Fast, efficent, hopefully the diagnoses are precise"
5,Great job. Keep up the good work. Thank you so much
5,Wow quick respond and fully responsive docter rather thank another apps doc..thank you Docter Niar for you patient😊🙏
5,Good doctor with it
1,"First experience using Halodoc when I need to consult with doctor regarding my covid test result, only to get copy pasted link to random e-form and one generic infographic about ""isoman"" from her. Repeated generic responses such as ""semoga lekas sembuh"", ""GBU"" etc. She insisted that I need to consult to Puskesmas to get Isoman letter when I do not need one as I already granted isoman from my office. I assume she was busy doing something else, bad service, lack of focus, no empathy, bad response"
5,Good exelemt service
1,"Payment issues, orders stalled, BYE!"
5,Fast and easy consult
5,The powerfull apps
5,Easy to use
4,"Appriciate the good deeds of Halodoc so much, but sorry, in my last experience, the doctor cannot provide a very good service, because she is dealing with another patient in our consult session. Overall the service still helped, thanks."
5,Tks for helping me
1,"Worst apps. I ordered medicine for my mom, usually it is delivered instantl, however, the last case was took 4 days to be delivered without having prior notification. Even the status was not clear, when I clicked to cancel, it said that there is a problem..and it kept saying that. So I called the CS, 3 times, because the chat bot is useless! I called CS to cancel my order but there was no progress until it was delivered after 4 days, I have bought from traditional drugs store. Such a waste!!!"
5,New way to reach doctor
5,"Very helpul application. Can consult with doctor, get medicine without need to go anywhere."
5,Very convenient and helpful app during this Pandemic. The doctors are responsive and medicines are sent directly to the address after ordering the prescriptions.
5,Thanks for help us!
5,Easy to use
5,"Its eay apps, very good apps"
5,Very helpful 👍
5,Good good good
5,"Easy to use, doctor is available even 4 in the morning"
5,Easy to use and resourceful
1,"i have sd 865 and 8gb ram, but i cannot barely scroll through list of items within the app. also, the ui sucks."
4,"Not really fast for the response, but i really like this app for the cheap price consultation, and you can order the medicine from this app too. Thank you Halodoc."
1,Need to wait 1-4 days for my medicine to be delivered
5,This apps very helpful when I self isolation because the pandemic.
5,"Easy to access, and excellent service. Thank you"
5,Good apps for telemedicine
5,Easy to use. Like it
5,Very useful for consult and get medicine
5,A very helpful and responsive health application. Nice
5,"Very very good this app, very helful and so kind for the docter... I felt like a personal docter...thanks for Halodoc.."
2,Gave 2stars considering good experience in the early days. But I just got my PCR test late and all Help channel they provide does not give me any solution.
5,Fast Respond good for urgent sick
5,"it is easy to access, use and help us to get quick solution for health care and services"
5,User friendly & also doctor very helpful
5,Love the app and very helpful for me
5,User friendly and very helpful
3,"I am quite dissapointed with this App during the pandemic rise ..while being able to get on line medical consultation and medicine is a great help for us but we expect Halodoc should also be able to give altenative medicine if the stock is empty in nearby drug store..especially for Influenza medicine which is very important during corona pandemic like this.. We suggest Doctors to be able to give several alternative list of medicines especially pandemic related medicines ,thank you!"
3,Very slow respon CS
5,good n reliable
5,"This apps is extraordinary, it helps us to get in touch with medication faster"
4,Simple and responsible
1,"Bad terrible user experience, health ministry said that it is free to use halodoc, turns out that have to pay and I do not mind but terrible payments process with credit card Half hearted"
5,Well Done !!!
5,Great and Helpful
5,"Helpful, useful and reliable"
2,It says payment unsuccessful when it is actually confirmed already
4,This app is very helpful but i hope halodoc will provides several options for pharmacies locatio so that when ordering a medicine they are not from far away pharmacies.
5,Really helpfull and easy to use
4,"Fast service, will use again"
5,"This app supercool, I seldom got sick but whenever getting sick I am always use this apps. Being partner with Gojek is super awesome!"
5,"Thank you halodoc,,"
5,"awesome, ....very useful when you get lazy going to pharmacy."
5,Very helpfull ... Thanks
5,Helpfull and reliable!
5,Good aplication.. thanks halodoc
5,Fast respond and very efficient!
5,Easy to use
5,Quick and reasonable services.
5,This apps has improved tremendously. Wrll done
5,Always helping me!!!!!!
5,Help ful aplication in pandemic era
5,Good Helping for Everyone
5,Very helpfull apps for your health
5,Very Helpful & simple
5,"Best place to do doctor consultation, has integration with insurance, pharmacy and laboratory"
1,Always malfunctioned when I am about to checkout the medicine
1,"bad experience, cs not helpful, my complaints not taken seriously, do not use this app, i warn you already"
5,"Fast service, informative to first time users"
5,I wish after you go out of the App you still can continue your transaction It logged me out from my previous transaction.i was in the middle of it and i had to start all over.
5,"Halodoc is the best compare to others similiar app without ""H"""
5,Super helpful. Thank you very much. Having this app is a must for everyone I guess.
5,Very useful apps
5,"You need doctor & other health product? Well, you have come to the right place"
5,Fast response and helpful
5,"this app very helpfull, recommended doctor."
5,Good apps...so much helping
4,Its a little bit hard because sometimes error
5,Best and so helpful
4,"Please activate chat with driver feature as it will ease our experience without having to contact driver separately through call, sms or even wa Fyi some houses do not have a good celular recipient hence they only could use wifi supported channel as in wa, in app chat, etc. Hope you could fix that, no issue other than that you saved mine & my family lives through 2021 covid, thank you"
4,I would love to give 5 star but the thing is I cannot locate my driver and see the navigation. Overall this app is helping me a lot especially during these bad times.
2,App is good! Difficult to change insurance which already linked with new number!
5,Very very useful
5,Nice app. Helpful
5,Easy and useful to keep our health
1,"What is wrong with the app, I am not able to use my insurance to purchase the medicines prescribed by the doctor!"
5,Helpful app in time of needs.
3,Feature to chat with doctor is great and the online medicine store is cool as well. My worst experience is in the booking for appointment with doctor. The schedule information is invalid (per information given by the hospital) and I cannot request for cancel by myself neither can the hospital staff. Please make the information of doctor schedule valid and reliable so people do not waste their time making an appointment and confirming with the hospital just for requsting it to be cancelled.
5,Simple and many choices for out healthy. Thank you very much 🙏
5,Great one stop health & medical solutions
5,Very helpfull apps when i need some medicines immediately
5,Easy and practical to use
5,"Good, very helpful during pandemic, thanks"
2,"The app keeps crashing down whenever I try to chat with the doctor and the fact that we have limited time to consult makes it difficult to use, please fix it."
5,helpful dok. friendly and details explanation
5,Easy to use
5,Helpfull aplication.. great
5,"Very helpfull, intuitive and easy to use. Thanks !"
5,easily and helpfully
5,Great app n helpful
5,Not bad for my first time.
5,Good doctor and easily to check our health
5,"Helping people, before long que at the clinic"
5,Fast and reliable
2,"Worst experience, i have already paid to chat with doctor but i always waiting that those doctor is ready to chat and did not get contact for customer service to chat again"
5,Very fast and efficient
1,"Please fix the notification bug, where the notification keep telling me to complete the purchase but i did not make any transaction in the application"
5,"Worst experience. For the first time I want to try this application and consult about veterinarians using the gopay payment method, but the balance has been deducted first while I cannot consult with the doctor, maybe cost cuts can be made after consulting so that the patient does not lose"
5,This is very useful. You can get the drug recommendation.
5,Best to consult experience doctor online
5,So far so good
5,One of the best apps! Very convenient!
5,DRH Ami is very helpful and patient. She gave guidelines on how to take care the adopt kitten with clear explanation in this prime time around 9.30ish pm. Recommended to consult with her
5,Very usefull apps
5,"The most complete health app, it is got everything you name it, you can even talk to real doctor, pharmacist. Especially during COVID pandemic this app is highly recommended and a must have a whole hospital in your pocket anytime you need it. It is got ton's of very detail information that you can compare to a real person, as long any virus around and keep on mutating this app will keep you standard safety protocol in place. Stay safe and God Bless."
5,Easy & friendly
4,The doctor seems doing other things on the same time. The response takes time. The domtor does.not answer all the questions.
5,"Good apps, reliable, and easy to use. 5 star!"
5,This app it is really helping for sure😊
5,Very helpful 👍👍👍👍👍👍👍
5,Good app for simple life
1,"Since the update, purchasing medicine for other person (family members) or even self are difficult. Seemed like they just want you to consult with their doctor. I uninstall immediately"
5,"I appreciate this app It help me during quarantine, when i need a medicines and in health facility on quarantine place not occupied"
5,Good and effective
3,"The app is good. It helps people to have a consultation with Specialist in an easy and less expensive way. However, there are no option for self-pick up medicine or an option that we can order the medicine straight to the med store. It is so uncomfotable to wait for the medicine's shipping for the next 4 days maximum, while suffering from the disease"
5,"really helpfull even we need consul in the middle of the night, the doctor was ready for it"
5,Good application for our healthy ⭐⭐⭐⭐⭐
5,"Super app , consultation with doctor and they sent the medicine within 1-2 hours ....awesome"
1,NO RECOMENDED!Buy medicine must have receipt.. even a no need medicine must include receipt... Apps for the easier buy medicine?? No that is not this apps.. Too complicated apps ever!
5,Best app ever
5,Great health app
4,Easy application. 👍
5,Great app as fast solution when we are not feeling well
5,Helpful in urgernt time
5,Quick response and helpful.
5,Nice. N always be update for variative.
4,Good but the medicine is quite expensive
5,"make it simple, fast, & easy"
5,You have to get this apps. Really helpful for our family.
5,Make all easy whennin urgent
5,"Help me so much, easier to consultation in harsh time."
5,"Good App, straight to the point"
1,"Worst Experience Trying to order swab test, the app shows an error but still got charged. have contacted the customer service and they said will email later regarding the problems. But till today there is no contact or email at all."
5,This apps really helpfull during pandemic.. very easy to used!!
4,Simple n express n very helfulllll
1,Worst service ever. Halodoc is not ready to handle the cashless insurance facility of Manulife. The cashless is useless. You have to wait for more than 3 days to get Halodoc approval to approve your request for cashless facility for each medical request. The list of hospital cashless facility is also not entirely listed in the apps yet. There are still many insurance that can do far better than Manulife cooperation with Halodoc. Do not be deceived by this apps that offer cashless facility.
4,"Customer service is very bad. Every time i called them, they were busy."
5,"Nice dok, thanks"
5,Good enough to chat with the health specialist. Better than we search from google.CMIW
